{
  "correlation_id": "corr-2026-03-19-0001",
  "conversation_id": "cw-conv-1001",
  "external_user_id": "ext-user-501",
  "channel": "web_chat",
  "name": "Иван Петров",
  "contact": "ivan@example.com",
  "contact_type": "email",
  "interest": "автоматизация входящих продаж",
  "description": "Нужен бот для первичного квалифицирования заявок с сайта.",
  "source": "chatwoot:web-inbox-01",
  "dedup_fingerprint": "lead-cw-conv-1001-v1",
  "created_at": "2026-03-19T09:15:00Z",
  "last_updated_at": "2026-03-19T09:16:00Z"
}
